CAPA ID,Related Finding ID,Requirement,Nonconformity Type (Major/Minor/OFI),Problem Statement,Immediate Correction (Containment),Root Cause,Corrective Action Plan,Owner,Due Date,Status,Verification Method,Effectiveness Verified By,Verification Date,Evidence IDs (EV-###)
CAPA-001,F-001,ISO 27001 Clause 6.2,OFI,Information security objectives and measurement plan are not documented.,Create ISMS objectives document draft.,Not yet analyzed,Create ISMS-006 Objectives & Metrics with 6 measurable objectives (owner/metric/target/frequency).,Security/GRC (Badr),2026-02-21,Implemented (pending verification),Audit review confirms objectives exist and are measurable.,Badr Karim,,EV-005
CAPA-002,F-002,ISO 27001 Clause 10.1,Minor,Corrective action process and CAPA tracking are not established.,Create CAPA tracker and define workflow.,Not yet analyzed,Finalize AUD-006 tracker + add CAPA process section and ensure all findings are tracked to closure.,Security/GRC (Badr),2026-02-14,Implemented (pending verification),Verify CAPA procedure exists and tracker is used for all findings.,Badr Karim,,EV-006
CAPA-003,F-003,ISO 27001 Clause 9.3,OFI,Management Review template and schedule are not documented.,Draft management review template.,Not yet analyzed,Create ISMS-007 Management Review Template and schedule quarterly reviews aligned with AUD-001.,Management (Simulated),2026-02-21,Implemented (pending verification),Check management review template exists and MR-001 record is captured.,Badr Karim,,EV-007
CAPA-004,F-004,Annex A A.8.8,Minor,Vulnerability remediation workflow/SLA tracking not documented (tool enabled only).,Create a simple vuln log and remediation SLA.,Not yet analyzed,Create Vulnerability Management Procedure + tracking log; create 1 sample vuln issue with triage and closure evidence.,Engineering Lead,2026-02-21,Implemented (pending verification),Review vulnerability procedure + verify log exists with SLA and sample entry.,Badr Karim,,EV-008
CAPA-005,F-005,Annex A A.8.4,OFI,No periodic access review record for repository permissions.,Perform initial repo access review and record it.,Not yet analyzed,Create Access Review Record template; perform repo access review and capture evidence.,Platform/DevOps Lead,2026-02-21,Open,Verify access review record exists and lists accounts/roles/approval.,Badr Karim,,,
